{
  "schema": "pga-e2e-review/0.3",
  "task": "S",
  "reviewerSlot": 2,
  "candidates": {
    "X": {
      "taskFit": "NOT_YET",
      "strength": "中心改为两端带竖向端板的横向胶囊通道，构成『两个端子由通道相连』的连接意象；整体居中对称，无文字、字母或数字，外壳设计语言、底部 anchor 与保护轮廓均保持不变，未见越界或杂散像素。",
      "concern": "功能语义不够清楚：唯一的高亮是一个停在通道偏左处的小橙点，缺少任何流向或转移线索，读起来更像熔丝/杆状独立部件而不是『把能量从一个端口传给另一个端口』；通道灰色与面板灰色对比低，焦点元素过小，中心层级弱，不细看接近空面板。",
      "hierarchyReadability": "弱。通道体与灰面板明度接近，唯一的强调色是小面积橙点，64px 下中心图形存在感不足，层级不成立。",
      "structuralCoherence": "中等。青/橙点缀与外壳配色一致且居中对称，但通道形态偏『插入的独立杆件』，与基线面板上方块端口的语言衔接较弱。",
      "visibleArtifacts": "未见明显杂散像素、越界或错位；橙点与端板边缘干净。"
    },
    "Y": {
      "taskFit": "MEETS",
      "strength": "中心是清楚的三段式传输符号：左端口（青边框、橙色填充，能量源）→ 两枚右向雪佛龙（橙，流向）→ 右端口（青边框、浅色填充，接收端），直白表达『能量从一个端口传给另一个端口』；雪佛龙是几何符号不是文字；沿用基线的青/橙配色与方块端口语言，水平轴线与面板协调，底部 anchor 与外壳不变。",
      "concern": "方向为单向（源在左端口、汇在右端口），若道具语义要求对称双向会略显受限；两端口填充色不同是刻意的源/汇区分，但极小尺寸下浅色填充可能被读成高亮而非端口，属轻微问题。",
      "hierarchyReadability": "好。橙色雪佛龙与端口填充对灰面板对比强，焦点明确，符号在 64px 下仍一眼可读，层级成立。",
      "structuralCoherence": "好。端口方块延续基线语言，雪佛龙与端口同一水平轴对齐，配色与外壳一致，整体像同一道具的原生设计。",
      "visibleArtifacts": "未见明显杂散像素、越界或错位；雪佛龙像素对齐整齐。"
    }
  },
  "pairwiseResult": "Y_PREFERRED",
  "confidence": "HIGH",
  "actualViews": [
    "baseline.png",
    "X.png",
    "Y.png",
    "contact-sheet.png"
  ],
  "imageEvidence": [
    {
      "view": "baseline.png",
      "sha256": "a16729ed106ebbe16b3155799dbe4fa96ddcfa63c71ce7719bac775a837aaf15",
      "callId": "reviewer-2-baseline.png",
      "sessionId": "zcode-subagent:agent_8a0938b8-8e93-4874-a39b-9b610027f303",
      "modelContextId": "agent_8a0938b8-8e93-4874-a39b-9b610027f303",
      "modelInput": true
    },
    {
      "view": "X.png",
      "sha256": "b38246c508c3d03660109eebd0e5b3a883dd399e99a9c807631495d390ae369b",
      "callId": "reviewer-2-X.png",
      "sessionId": "zcode-subagent:agent_8a0938b8-8e93-4874-a39b-9b610027f303",
      "modelContextId": "agent_8a0938b8-8e93-4874-a39b-9b610027f303",
      "modelInput": true
    },
    {
      "view": "Y.png",
      "sha256": "9210aaba643e678a42d935c4adecc9794f6ab78511b7b1b5814231d176fe5077",
      "callId": "reviewer-2-Y.png",
      "sessionId": "zcode-subagent:agent_8a0938b8-8e93-4874-a39b-9b610027f303",
      "modelContextId": "agent_8a0938b8-8e93-4874-a39b-9b610027f303",
      "modelInput": true
    },
    {
      "view": "contact-sheet.png",
      "sha256": "36e93e69b43f4c81fb863ab8097425a3d9448e8ee92161aa628a68d5f8a0d546",
      "callId": "reviewer-2-contact-sheet.png",
      "sessionId": "zcode-subagent:agent_8a0938b8-8e93-4874-a39b-9b610027f303",
      "modelContextId": "agent_8a0938b8-8e93-4874-a39b-9b610027f303",
      "modelInput": true
    }
  ],
  "keyEvidence": "直接查看 baseline.png、X.png、Y.png 并以 contact-sheet.png 放大复核。Candidate Y 以『源端口→双雪佛龙流向→接收端口』三段结构清楚表达能量在两端口间的传递，层级与可读性好且无文字；Candidate X 仅有两端子加通道和一枚静止偏置的小橙点，缺流向线索、对比低，传递语义弱，故 NOT_YET 且 pair 偏向 Y。"
}
