{
  "schema": "pga-e2e-review/0.3",
  "task": "S",
  "reviewerSlot": 1,
  "candidates": {
    "X": {
      "taskFit": "MEETS",
      "strength": "中心改造为垂直传输结构：上方端帽（橙色端子叠在青色基座上）作为发射端口，一条垂直导线向下连接一个橙色核心的圆形节点，节点下方导线继续收细延伸。读作能量从端口经通道流向接收节点/汇聚点，符合任务允许的端口-流向-连接-汇聚语义；中心占位的原始垫片阵列被明确替换为功能性结构，未见任何文字、字母或数字。",
      "concern": "两端不对称：上方是明确的端子，下方接收端是圆形节点，'一个端口传给另一个端口'的双端子对仗感弱于对称双端口布局，主导读法偏向'源到汇聚点'；节点下方导线的延伸用途略含糊。",
      "hierarchyReadability": "层级清晰：橙色圆形节点是最强视觉焦点，顶部端帽次之，细导线明确承担连接语义；垂直轴在深色中心面板上对比充分，小尺寸下各部件仍可分辨。",
      "structuralCoherence": "沿用外壳的青灰与橙色点缀语言，与底部橙色基座呼应；结构沿垂直中轴对称，落在中心区域内，与外壳的圆角轮廓和基座方向协调，未破坏 alpha 外轮廓观感。",
      "visibleArtifacts": "未发现明显孤立杂点、断裂或越界像素；节点下方导线的阶梯式收细在此分辨率下读作有意的锥形收尾而非锯齿。"
    },
    "Y": {
      "taskFit": "MEETS",
      "strength": "中心改造为水平双端口结构：左右各一个带内芯的方形端子，中间由细导线相连，通道中段串有橙青交替的小能量节点标记流动。最直接地表达'把能量从一个端口传给另一个端口'，端口-连接-流向三要素齐备；中心占位被功能性结构替换，未见任何文字、字母或数字。",
      "concern": "通道中段的能量节点串较小且较密，极小尺寸下相邻色点可能合并成一条彩带，个体节点的分辨度略降；左右端子内部细节在低分辨率下接近消失。",
      "hierarchyReadability": "两个方形端子锚定两端，视觉重心稳定；中段色点串清楚标出流动路径与方向感；水平构图在深色中心面板上对比清楚，整体一眼可读。",
      "structuralCoherence": "方形端子呼应原占位中心的垫片语言，配色沿用外壳的青灰/橙双色体系并与底部基座呼应；水平带居中、宽度克制，保持在中心区域内，与外壳轮廓和基座方向协调。",
      "visibleArtifacts": "未发现明显锯齿、断裂或越界像素；端子与导线的衔接干净，中段色点间距均匀。"
    }
  },
  "pairwiseResult": "Y_PREFERRED",
  "confidence": "MEDIUM",
  "actualViews": [
    "baseline.png",
    "X.png",
    "Y.png",
    "contact-sheet.png"
  ],
  "imageEvidence": [
    {
      "view": "baseline.png",
      "sha256": "a16729ed106ebbe16b3155799dbe4fa96ddcfa63c71ce7719bac775a837aaf15",
      "callId": "reviewer-1-baseline.png",
      "sessionId": "zcode-subagent:agent_c8da483b-388c-47ac-8158-78b7fb79a33b",
      "modelContextId": "agent_c8da483b-388c-47ac-8158-78b7fb79a33b",
      "modelInput": true
    },
    {
      "view": "X.png",
      "sha256": "d5474c2a90689ab7d564026e8839313a2a3160482406ac541431750c5a66c0d6",
      "callId": "reviewer-1-X.png",
      "sessionId": "zcode-subagent:agent_c8da483b-388c-47ac-8158-78b7fb79a33b",
      "modelContextId": "agent_c8da483b-388c-47ac-8158-78b7fb79a33b",
      "modelInput": true
    },
    {
      "view": "Y.png",
      "sha256": "c9d52b8b9165cd9d403d96dfdd9c908c4f6324a09d5a10b592cbdb2dca5ff03e",
      "callId": "reviewer-1-Y.png",
      "sessionId": "zcode-subagent:agent_c8da483b-388c-47ac-8158-78b7fb79a33b",
      "modelContextId": "agent_c8da483b-388c-47ac-8158-78b7fb79a33b",
      "modelInput": true
    },
    {
      "view": "contact-sheet.png",
      "sha256": "3287ae03e2466294e653d1d71a09f863c8c62008bc446704b2fce6b37e6c0525",
      "callId": "reviewer-1-contact-sheet.png",
      "sessionId": "zcode-subagent:agent_c8da483b-388c-47ac-8158-78b7fb79a33b",
      "modelContextId": "agent_c8da483b-388c-47ac-8158-78b7fb79a33b",
      "modelInput": true
    }
  ],
  "keyEvidence": "对照 baseline：原中心是无语义的垫片阵列（2x2 垫片加中心点），两个候选都把它替换为可读的能量传输结构并保留外壳、配色与底部基座。Candidate X（垂直：端帽-导线-圆形节点）以汇聚语义达标，焦点强但双端子对仗弱；Candidate Y（水平：双方形端口-导线-中段橙青能量节点串）最贴合任务主句'从一个端口传给另一个端口'，端口与流向最明确，故偏好 Y。两者均无文字/字母/数字，均未见明显视觉伪影；contact-sheet 上的 X/Y 标签位于资产像素之外，与单独图像一致，判定不受呈现位置影响。"
}
